{
  "detector_id": "tls-ja4-known-bad",
  "version": "2.0.0",
  "status": "verified_e2e",
  "required_capabilities": ["tls-handshake", "ja4"],
  "attack_techniques": ["T1573.002"],
  "input_records": ["ndr.tls"],
  "features_used": ["ja4", "sni"],
  "config_params": [
    { "name": "ja4_denylist_ref", "type": "string" }
  ],
  "evidence_produced": {
    "record": "ndr.finding.candidate.v1",
    "fields": ["ja4", "sni", "dest_ip"]
  },
  "known_limitations": [
    { "description": "Denylist coverage lags newly observed JA4 fingerprints by one refresh cycle." }
  ],
  "backing_tests": {
    "golden_pcap": ["pcap/ja4-cobaltstrike.pcap", "pcap/ja4-sliver.pcap"],
    "benign_control": ["pcap/benign-tls-browsers.pcap"],
    "performance": ["bench/tls-50k-handshakes.json"]
  },
  "first_supported_version": "2.0.0"
}
