{
  "detector_id": "anomaly-detector",
  "version": "1.0.0",
  "status": "shipped",
  "required_capabilities": [],
  "attack_techniques": [],
  "input_records": [
    "suricata.anomaly.v1",
    "ndr.observation.normalized.v1"
  ],
  "features_used": [
    "anomaly",
    "ts.normalized",
    "entities",
    "fields.src_ip",
    "fields.flow.bytes_toserver",
    "obs_id",
    "sensor_id",
    "anomaly.type",
    "anomaly.event",
    "host"
  ],
  "config_params": [
    {
      "name": "FEATURE_WINDOW_SECS",
      "type": "integer",
      "default": 300
    },
    {
      "name": "FEATURE_LATENESS_SECS",
      "type": "integer",
      "default": 60
    },
    {
      "name": "CHECKSUM_HEALTH_SHARE",
      "type": "number",
      "default": 0.5
    },
    {
      "name": "CHECKSUM_HEALTH_MIN_SAMPLE",
      "type": "integer",
      "default": 200
    },
    {
      "name": "CHECKSUM_HEALTH_WINDOW_SECS",
      "type": "integer",
      "default": 600
    }
  ],
  "evidence_produced": {
    "record": "contracts/finding.schema.json",
    "fields": [
      "finding_id",
      "tenant_id",
      "detector_id",
      "detector_version",
      "category",
      "severity",
      "confidence",
      "first_seen",
      "last_seen",
      "entities",
      "state",
      "evidence_refs",
      "sensor_ids",
      "summary"
    ]
  },
  "known_limitations": [
    {
      "description": "Protocol anomaly promotion and outbound-volume baseline detection are not e2e-verified. Run one replica; local cohort history resets on restart and late observations are excluded. No existing ATT&CK mapping for category anomaly."
    },
    {
      "description": "Unit/state test sources (not golden-PCAP evidence): services/anomaly-detector/test_anomaly.py"
    },
    {
      "description": "Measured quality is computed by services/feedback-service/quality.py (KTD2); static confidence weights are not measured precision or false-positive rates."
    },
    {
      "description": "sensor_checksum_rejection is a sensor-health signal, not a detection: it is a dominance heuristic reporting that invalid-checksum anomalies outnumbered every other anomaly one sensor reported over a window. It does not measure the share of traffic affected (the denominator is anomaly events, not packets, and the engine throttles events), does not establish that the capture path is unhealthy (a sensor reporting few other anomaly types can cross the threshold on sporadic corruption), cannot read the sensor's configuration, and cannot prove traffic went uninspected; confirmation needs the sensor's running config or stats counters, not a change in this share. Shares are per-replica because each replica tallies only its assigned partitions. The checksum_validation_suspected vs link_corruption_suspected verdict only orders the two candidate causes from accompanying decode-layer anomalies; both remain open and the confidence is the same. Operator guidance: services/anomaly-detector/README.md"
    }
  ],
  "backing_tests": {
    "golden_pcap": [],
    "benign_control": [
      "services/anomaly-detector/test_anomaly.py"
    ],
    "performance": []
  },
  "first_supported_version": "0.0.1"
}
