{"detector_id":"behavioral-detectors","version":"1.1.0","status":"shipped","required_capabilities":[],"attack_techniques":["T1071","T1071.004"],"input_records":["suricata.flow.v1","suricata.dns.v1"],"features_used":["flow.start","flow.end","flow.bytes_toserver","flow.bytes_toclient","dns.rrname","ndpi"],"config_params":[{"name":"WINDOW_SECS","type":"number","default":600},{"name":"EVAL_SECS","type":"number","default":30},{"name":"NDR_BEACON_AUTOCORR","type":"string","default":"1"},{"name":"NDR_BEACON_AUTOCORR_THRESHOLD","type":"number","default":0.7},{"name":"NDR_BEACON_AUTOCORR_MIN_STRENGTH","type":"number","default":0.5},{"name":"NDR_BEACON_AUTOCORR_MIN_CONNS","type":"integer","default":8},{"name":"NDR_BEACON_AUTOCORR_MIN_CYCLES","type":"number","default":4.0},{"name":"NDR_BEACON_AUTOCORR_MAX_BINS","type":"integer","default":512},{"name":"NDR_FQDN_BEACON_MIN_IPS","type":"integer","default":2},{"name":"NDR_FLOW_IDENTITY_CAP","type":"integer","default":2048}],"evidence_produced":{"record":"contracts/finding.schema.json","fields":["finding_id","tenant_id","detector_id","detector_version","category","severity","confidence","first_seen","last_seen","entities","state"]},"known_limitations":[{"description":"Beaconing and DNS tunneling are not e2e-verified; synthetic scoring and state tests do not establish golden-PCAP detection. Exfiltration maps only to tactic TA0010, omitted from attack_techniques."},{"description":"Unit/state test sources (not golden-PCAP evidence): services/behavioral-detectors/test_config_source.py, services/behavioral-detectors/test_contract.py, services/behavioral-detectors/test_detectors.py, services/behavioral-detectors/test_metrics.py, services/behavioral-detectors/test_ndpi.py, services/behavioral-detectors/test_ndpi_policy.py, services/behavioral-detectors/test_partition_scope.py, services/behavioral-detectors/test_timing.py"},{"description":"Measured quality is computed by services/feedback-service/quality.py (KTD2); static confidence weights are not measured precision or false-positive rates."},{"description":"Beaconing is scored first by outlier-robust interval statistics and, only when those do not fire, by a jitter/gap-tolerant autocorrelation fallback emitted under the SAME beacon detector_id (ADR 014). Autocorrelation recovers a dominant period; it does not prove C2, and it is NOT a general solution to heavy jitter \u2014 per-sleep randomisation random-walks the beacon phase, so around +/-50% per-interval jitter the correlation peak decays with it. Constant payload sizes cannot establish a period: raw timing strength is gated separately."},{"description":"Exfil bytes, connection counts and cumulative long-connection seconds are DERIVED by summing per-flow cumulative values keyed by flow identity, not accumulated (ADR 015), so replay and repeated cumulative interim flow records are idempotent. This is idempotency, not exactly-once delivery. Per-pair flow identities are capped (NDR_FLOW_IDENTITY_CAP); when the cap binds the aggregate is a FLOOR and the refused-write count is carried on the finding, never dropped silently."}],"backing_tests":{"golden_pcap":[],"benign_control":["services/behavioral-detectors/test_detectors.py"],"performance":[]},"first_supported_version":"0.0.1"}
