{
  "detector_id": "dns-detector",
  "version": "1.0.0",
  "status": "shipped",
  "required_capabilities": [],
  "attack_techniques": [
    "T1071"
  ],
  "input_records": [
    "suricata.dns.v1"
  ],
  "features_used": [
    "src_ip",
    "dns.rrname",
    "dns.rcode"
  ],
  "config_params": [
    {
      "name": "DGA_THRESHOLD",
      "type": "number",
      "default": 0.72
    },
    {
      "name": "NXDOMAIN_THRESHOLD",
      "type": "integer",
      "default": 20
    },
    {
      "name": "NXDOMAIN_WINDOW_SECS",
      "type": "number",
      "default": 300
    }
  ],
  "evidence_produced": {
    "record": "contracts/finding.schema.json",
    "fields": [
      "finding_id",
      "tenant_id",
      "detector_id",
      "detector_version",
      "category",
      "severity",
      "confidence",
      "first_seen",
      "last_seen",
      "entities",
      "state"
    ]
  },
  "known_limitations": [
    {
      "description": "DGA and NXDOMAIN bursts are not e2e-verified. The current c2 category maps to T1071; no more specific DGA technique is asserted."
    },
    {
      "description": "Unit/state test sources (not golden-PCAP evidence): services/dns-detector/test_dns_detect.py, services/dns-detector/test_dns_state.py"
    },
    {
      "description": "Measured quality is computed by services/feedback-service/quality.py (KTD2); static confidence weights are not measured precision or false-positive rates."
    }
  ],
  "backing_tests": {
    "golden_pcap": [],
    "benign_control": [
      "services/dns-detector/test_dns_detect.py"
    ],
    "performance": []
  },
  "first_supported_version": "0.0.1"
}
