{"detector_id":"protocol-detectors","version":"1.1.0","status":"shipped","required_capabilities":[],"attack_techniques":["T1071","T1090.004","T1110","T1571"],"input_records":["suricata.tls.v1","suricata.http.v1","suricata.ssh.v1","suricata.flow.v1","suricata.raw.v1"],"features_used":["tls","quic","http.http_user_agent","http.hostname","dest_port","app_proto","flow.bytes_toserver","flow.bytes_toclient"],"config_params":[{"name":"JA4_MIN_OBSERVATIONS","type":"integer","default":100},{"name":"JA4_MIN_SPAN_SECS","type":"number","default":86400},{"name":"JA4_BASELINE_TTL","type":"number","default":604800},{"name":"JA4_RARE_MAX_ENTITIES","type":"integer","default":2},{"name":"JA4_TRANSITION_WINDOW_SECS","type":"number","default":600},{"name":"JA4_TRANSITION_MIN_DISTINCT","type":"integer","default":5},{"name":"JA4_WARMUP","type":"integer","default":5},{"name":"JA4_SEEN_TTL","type":"number","default":86400},{"name":"APPROVED_RESOLVERS","type":"string","default":""}],"evidence_produced":{"record":"contracts/finding.schema.json","fields":["finding_id","tenant_id","detector_id","detector_version","category","severity","confidence","first_seen","last_seen","entities","state"]},"known_limitations":[{"description":"Client JA4 novelty is scored per source entity and is LEARN-ONLY until that entity's baseline is ready (both an observation count and an elapsed span); a low-traffic or newly seen entity therefore produces no JA4 finding by design. Standalone new-to-entity novelty is informational, not a C2 verdict, and JA4 never identifies a program, device or adversary. Legacy JA3 rarity, server fingerprint rarity, certificate anomalies, DoH and protocol heuristics are not e2e-verified; encrypted metadata visibility varies. Exfiltration tactic TA0010 is omitted."},{"description":"Unit/state test sources (not golden-PCAP evidence): services/protocol-detectors/test_proto.py, services/protocol-detectors/test_proto_state.py"},{"description":"Measured quality is computed by services/feedback-service/quality.py (KTD2); static confidence weights are not measured precision or false-positive rates."}],"backing_tests":{"golden_pcap":[],"benign_control":["services/protocol-detectors/test_proto.py"],"performance":[]},"first_supported_version":"0.0.1"}
